{"$schema":"../schemas/network-catalog.schema.json","apiVersion":"northgate/v1alpha1","catalogVersion":"2026.08.03.1","kind":"NetworkCatalog","profiles":[{"allowAttach":true,"allowCreate":false,"allowRebind":false,"approvalStatus":"proposed","id":"tooling-primary","serverPolicyId":"ng-network-tooling-primary-v1"},{"allowAttach":true,"allowCreate":false,"allowRebind":false,"approvalStatus":"proposed","id":"isolated-tooling","serverPolicyId":"ng-network-isolated-tooling-v1"},{"allowAttach":true,"allowCreate":false,"allowRebind":false,"approvalStatus":"proposed","id":"isolated-northgate","serverPolicyId":"ng-network-isolated-northgate-v1"},{"allowAttach":true,"allowCreate":false,"allowRebind":false,"approvalStatus":"proposed","id":"mail-dmz","serverPolicyId":"ng-network-mail-dmz-v1"},{"allowAttach":true,"allowCreate":false,"allowRebind":false,"approvalStatus":"approved","id":"sim-wan","serverPolicyId":"ng-network-sim-wan-v1"},{"allowAttach":true,"allowCreate":false,"allowRebind":false,"approvalStatus":"approved","id":"business-apps","serverPolicyId":"ng-network-business-apps-v1"},{"allowAttach":true,"allowCreate":false,"allowRebind":false,"approvalStatus":"approved","id":"commercial-dmz","serverPolicyId":"ng-network-commercial-dmz-v1"},{"allowAttach":true,"allowCreate":false,"allowRebind":false,"approvalStatus":"approved","id":"users-workstations","serverPolicyId":"ng-network-users-workstations-v1"},{"allowAttach":true,"allowCreate":false,"allowRebind":false,"approvalStatus":"approved","id":"mail-internal","serverPolicyId":"ng-network-mail-internal-v1"},{"allowAttach":true,"allowCreate":false,"allowRebind":false,"approvalStatus":"approved","id":"it-admin-workstations","serverPolicyId":"ng-network-it-admin-workstations-v1"},{"allowAttach":true,"allowCreate":false,"allowRebind":false,"approvalStatus":"approved","id":"cyber-workstations","serverPolicyId":"ng-network-cyber-workstations-v1"},{"allowAttach":true,"allowCreate":false,"allowRebind":false,"approvalStatus":"approved","id":"external-mail","serverPolicyId":"ng-network-external-mail-v1"}]}